208,3816492,DES,,,PreservedSpecimen,463dff76-5238-48c2-961a-3241e1688869,DES00039361,,Plantae,Magnoliophyta,,Caryophyllales,Cactaceae,Grusonia grahamii,18273,(Engelm.) H. Robinson,Grusonia,grahamii,,,Donald J. Pinkava,2008,,Determination verified by Joselyn Fenstermacher. 10-2014,,,,Allan Zimmerman,Richard Worthington,2631,11/13/1990,1990,11,13,317,,,"Worthington's only site in this area for O. grahamii and Stylocline micropoides, the latter known in Texas from only this site and the type collection, ""stony hills near Frontera"", also type locality for O. grahamii. As a tetraploid, by Pinkava, vouchers at UTEP, SRSC.",Andesite hills with lecguguilla.,,"Isolated population of a dozen or more old clumps and their clonal fragments; not forming long trailing chains like O. schottii, rather, stems are mostly of ascending series 3-5 joints long end-to-end joints; eventually sagging onto each other forming heaps, but not ground-hugging mats.",,,,,"Echinocactus horizonthalonius, Ferocactus, Opuntia leptocaulis, Opuntia macrocentra, Echinocereus dasyacanthus",,,,,,,,USA,Texas,El Paso,,"NW edge of El Paso, a mile or two of Mesa Road/Drive, a short distance N of Belvedere St., ca 0.5 mile? E. of intersection of Belvedere and Resler",,0,,31.75861,-106.48639,WGS84,29410,,,,GeoLocate,,,1280,,,,,4200 ft,,,eleanoreros,05/02/17 17:52,,5,urn:uuid:463dff76-5238-48c2-961a-3241e1688869,http://swbiodiversity.org/seinet/collections/individual/index.php?occid=3816492,https://serv.biokic.asu.edu/imglib/h_seinet/seinet/DES/DES00039/DES00039361_lg.jpg
209,3816492,DES,,,PreservedSpecimen,463dff76-5238-48c2-961a-3241e1688869,DES00039361,,Plantae,Magnoliophyta,,Caryophyllales,Cactaceae,Grusonia grahamii,18273,(Engelm.) H. Robinson,Grusonia,grahamii,,,Donald J. Pinkava,2008,,Determination verified by Joselyn Fenstermacher. 10-2014,,,,Allan Zimmerman,Richard Worthington,2631,11/13/1990,1990,11,13,317,,,"Worthington's only site in this area for O. grahamii and Stylocline micropoides, the latter known in Texas from only this site and the type collection, ""stony hills near Frontera"", also type locality for O. grahamii. As a tetraploid, by Pinkava, vouchers at UTEP, SRSC.",Andesite hills with lecguguilla.,,"Isolated population of a dozen or more old clumps and their clonal fragments; not forming long trailing chains like O. schottii, rather, stems are mostly of ascending series 3-5 joints long end-to-end joints; eventually sagging onto each other forming heaps, but not ground-hugging mats.",,,,,"Echinocactus horizonthalonius, Ferocactus, Opuntia leptocaulis, Opuntia macrocentra, Echinocereus dasyacanthus",,,,,,,,USA,Texas,El Paso,,"NW edge of El Paso, a mile or two of Mesa Road/Drive, a short distance N of Belvedere St., ca 0.5 mile? E. of intersection of Belvedere and Resler",,0,,31.75861,-106.48639,WGS84,29410,,,,GeoLocate,,,1280,,,,,4200 ft,,,eleanoreros,05/02/17 17:52,,5,urn:uuid:463dff76-5238-48c2-961a-3241e1688869,http://swbiodiversity.org/seinet/collections/individual/index.php?occid=3816492,https://api.idigbio.org/v2/media/21502e7ae1efce0765161a17fcf879b2?size=fullsize
210,11053667,ASU,Plants,,PreservedSpecimen,7057d1c5-9d62-407d-b4ea-68b0035829ce,ASU0102341,187831,Plantae,Magnoliophyta,,Caryophyllales,Cactaceae,Grusonia grahamii,18273,(Engelm.) H. Robinson,Grusonia,grahamii,,,J. Fenstermacher,2010,,,,,,A.D. Zimmerman,D.A. Zimmerman,2723,3/25/1975,1975,3,25,84,,,,,,,,,,,,,,,,,,,USA,New Mexico,Dona Ana,,"ca 12 mi SE of Las Cruces, SW end of Bishop's Cap Mtns.",,0,,,,,,,,,,,,1311,,,,,4300',,,waltola64,03/12/18 20:05,,1,urn:uuid:7057d1c5-9d62-407d-b4ea-68b0035829ce,http://swbiodiversity.org/seinet/collections/individual/index.php?occid=11053667,https://api.idigbio.org/v2/media/7ec1ee869c92f4223fbda172bc78f45c?size=fullsize
211,11053668,ASU,Plants,,PreservedSpecimen,a2eb0a3b-34fe-454d-ace5-d8cdac319082,ASU0102342,152547,Plantae,Magnoliophyta,,Caryophyllales,Cactaceae,Grusonia grahamii,18273,(Engelm.) H. Robinson,Grusonia,grahamii,,,J. Fenstermacher,2010,,,,,,R.D. Worthington,,6910.5,04/05/81,1981,4,5,95,,,,Mostly a creosote bush community with several substrate types and arroyos.,,,,,,,,,,,,,,,USA,Texas,El Paso,,"El Paso, NW part of city at small andesite hills 0.3 miles N of junction Belvedere with Westwind",,0,,31.870833,-106.540278,,,"31d 52' 15"" N 106d 32' 25"" W",,,,,,1280,,,,,4200ft,,,waltola64,07/07/17 12:49,,1,urn:uuid:a2eb0a3b-34fe-454d-ace5-d8cdac319082,http://swbiodiversity.org/seinet/collections/individual/index.php?occid=11053668,https://api.idigbio.org/v2/media/1076c25ead0f5c1cd7911219709c6cb3?size=fullsize
212,965028,ARIZ,,,PreservedSpecimen,urn:uuid:38552802-fc19-4c24-adfd-5d43d90cfde0,307618,,Plantae,Magnoliophyta,,Caryophyllales,Cactaceae,Mammillaria barbata,18407,Engelm.,Mammillaria,barbata,,,J.E. Laferriere,10/15/1988,,,,,,J. E. Laferriere;,,,10/15/1988,1988,10,15,289,,"Oct,15,1988",,,,,,,,,,,,,,,,,Mexico,Chihuahua,Temósachi,,"Nabogame, Mpio.Temosachi, Chih.",,,,28.5,-108.5,,,,,,,,,,,,,,,,,,11/07/13 11:43,255977,2,urn:uuid:7bc9c254-f6b4-4dbb-ae13-d1a3a30a1eb9,http://swbiodiversity.org/seinet/collections/individual/index.php?occid=965028,http://db.herbarium.arizona.edu/images/ARIZ/307/ariz307618_lg.jpg
213,965028,ARIZ,,,PreservedSpecimen,urn:uuid:38552802-fc19-4c24-adfd-5d43d90cfde0,307618,,Plantae,Magnoliophyta,,Caryophyllales,Cactaceae,Mammillaria barbata,18407,Engelm.,Mammillaria,barbata,,,J.E. Laferriere,10/15/1988,,,,,,J. E. Laferriere;,,,10/15/1988,1988,10,15,289,,"Oct,15,1988",,,,,,,,,,,,,,,,,Mexico,Chihuahua,Temósachi,,"Nabogame, Mpio.Temosachi, Chih.",,,,28.5,-108.5,,,,,,,,,,,,,,,,,,11/07/13 11:43,255977,2,urn:uuid:7bc9c254-f6b4-4dbb-ae13-d1a3a30a1eb9,http://swbiodiversity.org/seinet/collections/individual/index.php?occid=965028,http://db.herbarium.arizona.edu/images/ARIZ/307/ariz307618_lg.jpg
214,965030,ARIZ,,,PreservedSpecimen,urn:uuid:36fc3394-1253-46d0-95c0-6f70ce3f3224,307609,,Plantae,Magnoliophyta,,Caryophyllales,Cactaceae,Mammillaria barbata,18407,Engelm.,Mammillaria,barbata,,,J.E. Laferriere,10/25/1988,,,,,,J. E. Laferriere;,,,10/25/1988,1988,10,25,299,,"Oct,25,1988",,Sunny cliff near center of village,,,,,,,,,,,,,,,Mexico,Chihuahua,Temósachi,,"Nabogame, Mpio.Temosachi, Chih.",,,,28.5,-108.5,,,,,,,,,,,,,,,,,,11/07/13 11:43,255979,2,urn:uuid:419935ef-3214-4e16-99f7-9bce1ca6e7fa,http://swbiodiversity.org/seinet/collections/individual/index.php?occid=965030,http://db.herbarium.arizona.edu/images/ARIZ/307/ariz307609_lg.jpg
215,965030,ARIZ,,,PreservedSpecimen,urn:uuid:36fc3394-1253-46d0-95c0-6f70ce3f3224,307609,,Plantae,Magnoliophyta,,Caryophyllales,Cactaceae,Mammillaria barbata,18407,Engelm.,Mammillaria,barbata,,,J.E. Laferriere,10/25/1988,,,,,,J. E. Laferriere;,,,10/25/1988,1988,10,25,299,,"Oct,25,1988",,Sunny cliff near center of village,,,,,,,,,,,,,,,Mexico,Chihuahua,Temósachi,,"Nabogame, Mpio.Temosachi, Chih.",,,,28.5,-108.5,,,,,,,,,,,,,,,,,,11/07/13 11:43,255979,2,urn:uuid:419935ef-3214-4e16-99f7-9bce1ca6e7fa,http://swbiodiversity.org/seinet/collections/individual/index.php?occid=965030,http://db.herbarium.arizona.edu/images/ARIZ/307/ariz307609_lg.jpg
216,2068119,DES,,,PreservedSpecimen,cc946a1b-d8a9-4e74-8c36-8541190ca603,DES00066401,,Plantae,Magnoliophyta,,Caryophyllales,Cactaceae,Opuntia cymochila,18475,Engelm. & Bigelow,Opuntia,cymochila,,,Lucas C. Majure,Aug. 2015,,,,,,Joni Ward,,jbw 361,7/24/2008,2008,7,24,206,,,,High plains grasslands with some limestone.,,"Plant common, low growing, prostrate, branching with 1-4 pads; pads yellow-green or green, newer pads bluish-gray-green, older pads wrinkled; spines 2-5, long, white with dark tips, some spines reddish-brown at base or golden; glochids brown; fruit not quite ripe but seeds are formed, fruit fleshy, green with a tint of purple at top, length 27-40 mm, diameter 13-17 mm; seeds appear black; 2 fruits from plant growing in DBG greenhouse 7 October 2008, length 28-29 mm, length 17 mm, color purplish-green-mottled, fruit has glochids, no spines, juicy, sweet/tart with salty undertaste; seeds tan, 4 mm.",,,,,"Yucca, Opuntia polyacantha, Atriplex canescens,, Asclepias latifolia, Melampodium leucanthum, Cryptantha cinerea, Grindelia squarrosa",,,0,,,,,USA,Colorado,Pueblo County,,"From Pueblo and I-25 west on Hwy 50 to North Pueblo Blvd, south to 24th St, then east in an open field on the north side of the street; open area has probably been grazed but is scheduled for development.",,0,,38.290833,-104.657972,,,38d 17m 27s N; 104d 39m 28.7s W,,,,,,1475,,,,,4842ft.,,,joni,09/11/15 17:54,36401,5,urn:uuid:cc946a1b-d8a9-4e74-8c36-8541190ca603,http://swbiodiversity.org/seinet/collections/individual/index.php?occid=2068119,https://serv.biokic.asu.edu/imglib/h_seinet/seinet/DES/DES00066/DES00066401_lg.jpg
217,2068119,DES,,,PreservedSpecimen,cc946a1b-d8a9-4e74-8c36-8541190ca603,DES00066401,,Plantae,Magnoliophyta,,Caryophyllales,Cactaceae,Opuntia cymochila,18475,Engelm. & Bigelow,Opuntia,cymochila,,,Lucas C. Majure,Aug. 2015,,,,,,Joni Ward,,jbw 361,7/24/2008,2008,7,24,206,,,,High plains grasslands with some limestone.,,"Plant common, low growing, prostrate, branching with 1-4 pads; pads yellow-green or green, newer pads bluish-gray-green, older pads wrinkled; spines 2-5, long, white with dark tips, some spines reddish-brown at base or golden; glochids brown; fruit not quite ripe but seeds are formed, fruit fleshy, green with a tint of purple at top, length 27-40 mm, diameter 13-17 mm; seeds appear black; 2 fruits from plant growing in DBG greenhouse 7 October 2008, length 28-29 mm, length 17 mm, color purplish-green-mottled, fruit has glochids, no spines, juicy, sweet/tart with salty undertaste; seeds tan, 4 mm.",,,,,"Yucca, Opuntia polyacantha, Atriplex canescens,, Asclepias latifolia, Melampodium leucanthum, Cryptantha cinerea, Grindelia squarrosa",,,0,,,,,USA,Colorado,Pueblo County,,"From Pueblo and I-25 west on Hwy 50 to North Pueblo Blvd, south to 24th St, then east in an open field on the north side of the street; open area has probably been grazed but is scheduled for development.",,0,,38.290833,-104.657972,,,38d 17m 27s N; 104d 39m 28.7s W,,,,,,1475,,,,,4842ft.,,,joni,09/11/15 17:54,36401,5,urn:uuid:cc946a1b-d8a9-4e74-8c36-8541190ca603,http://swbiodiversity.org/seinet/collections/individual/index.php?occid=2068119,https://api.idigbio.org/v2/media/84d590bc2b098211371ad22cc778161f?size=fullsize
218,2057435,DES,,,PreservedSpecimen,58a9cc98-6d75-4922-873b-35f208e25888,DES00009728,,Plantae,Magnoliophyta,,Caryophyllales,Cactaceae,Opuntia humifusa,18476,(Raf.) Raf.,Opuntia,humifusa,,,,,,,,,,J. Harry Lehr,,1230,05/07/74,1974,5,7,127,,,"Flower 7-May-74, fruit 16-Nov-73, pad 21-May-74. Plant sent by Louis Hand and replanted in Phoenix by collector.",Dry bank near site of former iron furnace.,,,,,,,,flowers & fruit,,0,,,,,USA,New Jersey,Burlington County,,"Batso Village, Wharton State Forest",,0,,39.643333,-74.652222,,,,,,ACC_082911,,,,,,,,,,,Steve,01/06/15 14:31,22658,5,urn:uuid:58a9cc98-6d75-4922-873b-35f208e25888,http://swbiodiversity.org/seinet/collections/individual/index.php?occid=2057435,https://serv.biokic.asu.edu/imglib/h_seinet/seinet/DES/DES00009/DES00009728_lg.jpg
219,2057437,DES,,,PreservedSpecimen,df44091d-77ea-4104-bd58-c173db14dcab,DES00009727,,Plantae,Magnoliophyta,,Caryophyllales,Cactaceae,Opuntia humifusa,18476,(Raf.) Raf.,Opuntia,humifusa,,,,,,,,,,J. Harry Lehr,,1229,05/05/74,1974,5,5,125,,,"Flower 5-May-74, fruit 18-Nov-73, pad 21-May-74. Plant sent by John Priced and replanted in Phoenix by collector.",Rocky outcrop,,Common,,,,,Quercus ilicifolia.,flowers & fruit,,0,,,,,USA,New York,Rockland County,,"Top of knoll, southside entrance causeway to Iona Island.",,0,,41.300139,-73.981361,,,,,,ACC_082911,,,15,,,,,50ft.,,,Steve,01/06/15 14:31,22660,5,urn:uuid:df44091d-77ea-4104-bd58-c173db14dcab,http://swbiodiversity.org/seinet/collections/individual/index.php?occid=2057437,https://serv.biokic.asu.edu/imglib/h_seinet/seinet/DES/DES00009/DES00009727_lg.jpg
220,1101613,DES,,,PreservedSpecimen,8b841cff-930a-4d8b-b0aa-12582dfe3116,DES00057990,,Plantae,Magnoliophyta,,Caryophyllales,Cactaceae,Cylindropuntia abysii,18918,(Hester) Beckeberg,Cylindropuntia,abysii,,,D. J. Pinkava,,,,,,,Wendy C. Hodgson,"Lori Makarick, Kate Watters",19725,5/17/2005,2005,5,17,137,,,,Cryptogamic soil,,"Erect shrub, frequent, to 11-1/4 m high and wide.",,,,,"Phacelia ambigua, Bebbia juncea, Acacia greggii, Gutierrezia sarothrae, Alhagi maurorum, Abronia elliptica, Krameria erecta, Eriogonum fasciculatum, Isocoma acradenia, Pluchea sericea, Oenothera pallida, Tamarix ramosissima, Opuntia engelmannii (red flowered), Baccharis salicifolia, Encelia farinosa, Camissonia walkeri, Larrea tridentata, Phoradendron californica, Ephedra fasciculata, Aristida, Sphaeralcea, Allionia incarnata, Dasyochloa pulchellum, Thymophylla pentachaeta bellenidium, Datura wrightii, Stephanomeria pauciflora, Bromus rubens, Prosopis glandulosa, Cryptantha, Oenothera caespitosa, Lycium, Nicotiana oblongifolia, Salix gooddingii.",fruit,,0,,,,,USA,Arizona,Coconino County,,"Ca 20 yards from Colorado River on bank, RM 209L, near mouth of Granite Park Canyon.",,0,,35.968983,-113.315717,,,35d 58.139m N; 113d 18.943m W,,,,,,448,,,,,,,,Wendy,08/03/17 19:33,15998,5,urn:uuid:8b841cff-930a-4d8b-b0aa-12582dfe3116,http://swbiodiversity.org/seinet/collections/individual/index.php?occid=1101613,https://serv.biokic.asu.edu/imglib/h_seinet/seinet/DES/DES00057/DES00057990_lg.jpg
221,1101614,DES,,,PreservedSpecimen,e02b06ce-dfc5-4565-982a-7af5cbec4cfc,DES00058030,,Plantae,Magnoliophyta,,Caryophyllales,Cactaceae,Cylindropuntia abysii,18918,(Hester) Beckeberg,Cylindropuntia,abysii,,,,,,,,cf,,Wendy C. Hodgson,"Lori Makarick, Kate Watters",21122,5/14/2006,2006,5,14,134,,,Sheet I of II.,Desert scrub on rocky bench above creekbed,,"Erect plant to 2/3 - 3/4 m high, flowers glossy yellow, 57(l)x43(w) mm.",,,,,"Ferocactus cylindraceus, Acacia greggii, Dasyochloa pulchella, Camissonia walkeri, Bebbia juncea, Isocoma acradenia, Larrea tridentata.",,,0,,,,,USA,Arizona,Coconino County,,"Grand Canyon, Hualapai Indian Reservation, near mouth of Prospect Canyon near RM 179, 12S 312863 E, 4007801 N, NAD 83.",,0,,36.19695,-113.0814,NAD 83,,36d 11.817m N; 113d 4.884m W; UTM: 400780131286312S,,,,,,522,,,,,,,,Wendy,08/03/17 19:33,16009,5,urn:uuid:e02b06ce-dfc5-4565-982a-7af5cbec4cfc,http://swbiodiversity.org/seinet/collections/individual/index.php?occid=1101614,https://serv.biokic.asu.edu/imglib/h_seinet/seinet/DES/DES00058/DES00058030_lg.jpg
222,1101615,DES,,,PreservedSpecimen,6e88e51c-6239-4895-9901-bda5c189ef65,DES00058923,,Plantae,Magnoliophyta,,Caryophyllales,Cactaceae,Cylindropuntia abysii,18918,(Hester) Beckeberg,Cylindropuntia,abysii,,,,,,,,,,Wendy C. Hodgson,,22012,5/17/2007,2007,5,17,137,,,Sheet 2 of 2.,"Desert scrub, sandy, rocky, cryptogamic soil",,"Local, only a few plants in area, to 1 m high, 1-3/4 m wide, densely spined, fruits tuberculate, fleshy, yellowish-green.",,,,,"Opuntia basilaris basilaris, O. polyacantha erinaceae, Acacia greggii, Sporobolis cryptandrus, Ambrosia dumosa, Gutierrezia sarothrae, Prosopis glandulosa, Baileya multiradiata, Rhus trilobatat simplicifolia, Krameria erecta.",,,0,,,,,USA,Arizona,Mohave County,,"Grand Canyon National Park, river mile 188, Whitmore Canyon, near mouth and just west of camp sites and River.",,0,,36.145567,-113.202233,,,36d 8.734m N; 113d 12.134m W,,,,,,501,,,,,1646ft.,,,Wendy,01/06/15 14:31,21172,5,urn:uuid:6e88e51c-6239-4895-9901-bda5c189ef65,http://swbiodiversity.org/seinet/collections/individual/index.php?occid=1101615,https://serv.biokic.asu.edu/imglib/h_seinet/seinet/DES/DES00058/DES00058923_lg.jpg
223,965347,ARIZ,,,PreservedSpecimen,urn:uuid:3da9040c-372c-4213-b3b5-308f55f50948,211853,,Plantae,Magnoliophyta,,Caryophyllales,Cactaceae,Acanthocereus,19013,,Acanthocereus,,,,D.J. Keil,04/04/69,,,,,,D. J. Keil; Meyer & Lewis & D. J. Pinkava,,,04/04/69,1969,4,4,94,,"Apr,4,1969",,NE facing slope,,,,,,,,,,,,,,,Mexico,Coahuila,Cuatrocienegas,,"Sierra de San Marcos, opposite Los Fresnos, Cuatro Ciénegas basin, Coah.",,,,,,,,,,,,,,,,,,,,,,,11/07/13 11:43,256296,2,urn:uuid:e6a2f3b0-5dd3-4c65-8804-3c88284b5ffa,http://swbiodiversity.org/seinet/collections/individual/index.php?occid=965347,http://db.herbarium.arizona.edu/images/ARIZ/211/ariz211853_lg.jpg
224,965347,ARIZ,,,PreservedSpecimen,urn:uuid:3da9040c-372c-4213-b3b5-308f55f50948,211853,,Plantae,Magnoliophyta,,Caryophyllales,Cactaceae,Acanthocereus,19013,,Acanthocereus,,,,D.J. Keil,04/04/69,,,,,,D. J. Keil; Meyer & Lewis & D. J. Pinkava,,,04/04/69,1969,4,4,94,,"Apr,4,1969",,NE facing slope,,,,,,,,,,,,,,,Mexico,Coahuila,Cuatrocienegas,,"Sierra de San Marcos, opposite Los Fresnos, Cuatro Ciénegas basin, Coah.",,,,,,,,,,,,,,,,,,,,,,,11/07/13 11:43,256296,2,urn:uuid:e6a2f3b0-5dd3-4c65-8804-3c88284b5ffa,http://swbiodiversity.org/seinet/collections/individual/index.php?occid=965347,http://db.herbarium.arizona.edu/images/ARIZ/211/ariz211853_lg.jpg
225,7670641,ASU,Plants,,PreservedSpecimen,4f005220-530c-49fc-a955-e0a8edee4268,ASU0089285,188826,Plantae,Magnoliophyta,,Caryophyllales,Cactaceae,Cleistocactus,19118,Lem.,Cleistocactus,,,,,,,,,,,Charlotte Christy,,s.n.,5/15/1993,1993,5,15,135,,,Cited in Baker et al. 2009. J. Bot. Res. Inst. Texas 3(1) p. 280,Cultivated,,"Flowers zygomorphic, nectary ca. 5 mm long; filaments white, anthers pink to purple.",,,,,,,,,,,,,USA,Arizona,Maricopa,Tempe,"Arizona State University, Tempe, Arizona",,,,33.414768,-111.90931,WGS84,9739,,,,GeoLocate,,,,,,,,,,,pbreslin,03/12/18 20:05,,1,urn:uuid:4f005220-530c-49fc-a955-e0a8edee4268,http://swbiodiversity.org/seinet/collections/individual/index.php?occid=7670641,https://serv.biokic.asu.edu/imglib/h_seinet/seinet/ASU_Plants/201509/ASU0089285_1443568303_lg.jpg
226,3269627,DES,,,PreservedSpecimen,cb7bde19-e3ba-4a1f-a09a-4d26df6d3ad1,DES00002040,,Plantae,Magnoliophyta,,Caryophyllales,Cactaceae,Echinopsis,19170,,Echinopsis,,,,,,,,,,,E. R. Blakley,,B-520,08/08/51,1951,8,8,220,,,Hybrid. Cultivation at DBG#2235.,,,Yellow flower.,,,,,,flowers,,,,,,,USA,Arizona,Maricopa,,"In cultivation Desert Botanical Garden, Phoenix, Maricopa County, AZ. DBG#2235.",,0,,33.46102,-111.944479,WGS84,3036,,,,GeoLocate,,,390,,,,,1280',,,karrivas,10/07/17 17:49,,5,urn:uuid:cb7bde19-e3ba-4a1f-a09a-4d26df6d3ad1,http://swbiodiversity.org/seinet/collections/individual/index.php?occid=3269627,https://serv.biokic.asu.edu/imglib/h_seinet/seinet/DES/DES00002/DES00002040_lg.jpg
227,24775297,NY,,,PreservedSpecimen,55244224-ae42-48c2-8046-a9edeca464be,3860939,,Plantae,Magnoliophyta,,Caryophyllales,Cactaceae,Nopalea,19321,,Nopalea,,,,,,,,,,,P. F. May,,1921,06/06/01,2001,6,6,15,15,06-Jun-01,,,,,,,,,,,,,,,,sheet,Mexico,Campeche,Calkiní,,km 9 Tankuche-El Remate,[Mexico & Central America],,,20.5278,-90.3306,,,,,,,,,,,,,,,,en,,2/26/2020 11:51,55244224-ae42-48c2-8046-a9edeca464be,40,urn:uuid:247fcdf2-9566-4cbe-a97d-0ef9ebcb9084,http://swbiodiversity.org/seinet/collections/individual/index.php?occid=24775297,http://sweetgum.nybg.org/images3/3329/851/03860939.jpg
228,21900865,WIS,,,PreservedSpecimen,9fbc6e31-9e2b-49f1-a093-580284c77a45,v0383156WIS,,Plantae,Magnoliophyta,,Caryophyllales,Cactaceae,Pereskiopsis,19345,,Pereskiopsis,,,,,,,,,,,Hugh H. Iltis,,29166,,,,,,,,,,,,,,,,,,,,,,,,Mexico,Jalisco,Jocotepec,,,,,,,,,,,,,,,,,,,,,,,en,callydittmann,09/12/19 16:06,,198,urn:uuid:9fbc6e31-9e2b-49f1-a093-580284c77a45,http://swbiodiversity.org/seinet/collections/individual/index.php?occid=21900865,https://wis.botany.wisc.edu/WIS/Magnoliidae2020-02b/v0383156WIS.JPG
229,1081006,DES,,,PreservedSpecimen,616f127d-67c3-4b01-815a-86e1d70a2d15,DES00040710,,Plantae,Magnoliophyta,,Caryophyllales,Cactaceae,Cylindropuntia acanthocarpa var. coloradensis,19512,(L.D.Benson) D.J.Pinkava,Cylindropuntia,acanthocarpa,var.,coloradensis,,,,,,,,Wendy C. Hodgson,"Liz Slauson, Ron Hill",9183,5/16/1995,1995,5,16,136,,,,,,Common.  Perianth bronze with red tips; filaments maroon; anthers yellow; stigma cream-chartreuse; style whitish.,,,,,"Larrea, Ephedra,, Cylindropuntia bigelovii, Cylindropuntia acanthocarpa, Krameria grayi, Acamptopappus sphaerocephalus, Ambrosia dumosa, Acacia greggii, Bromus rubens, Cercidium floridum, Lupinus",,,0,,,,,USA,Arizona,Mohave County,,"Black Mountains. W flank. Grapevine Canyon Spring, at end of road",,0,,35.08145,-114.3948,,,35d 4.887m N; 114d 23.69m W,,,,,,768,,,,,2520ft.,,,,01/06/15 14:31,9271,5,urn:uuid:616f127d-67c3-4b01-815a-86e1d70a2d15,http://swbiodiversity.org/seinet/collections/individual/index.php?occid=1081006,https://serv.biokic.asu.edu/imglib/h_seinet/seinet/DES/DES00040/DES00040710_lg.jpg
230,1081012,DES,,,PreservedSpecimen,c4e4fc69-68df-43d2-9a35-de9684960f33,DES00028906,,Plantae,Magnoliophyta,,Caryophyllales,Cactaceae,Cylindropuntia acanthocarpa var. coloradensis,19512,(L.D.Benson) D.J.Pinkava,Cylindropuntia,acanthocarpa,var.,coloradensis,Donald J. Pinkava,1993,,,,,,Wendy C. Hodgson,,2758,03/11/84,1984,3,11,71,,,,Yuma Desert on granitic low slopes.,,Flowers orange-yellow,,,,,,,,0,,,,,USA,Arizona,Yuma County,,"Ca. 1/4 mi. S of A-1 Basin, N of Surprise Canyon",,0,,32.338333,-113.788611,,,32d 20m 18s N; 113d 47m 19s W,,,,,,,,,,,,,,,7/13/2015 14:23,9277,5,urn:uuid:c4e4fc69-68df-43d2-9a35-de9684960f33,http://swbiodiversity.org/seinet/collections/individual/index.php?occid=1081012,https://serv.biokic.asu.edu/imglib/h_seinet/seinet/DES/DES00028/DES00028906_lg.jpg
231,1081022,DES,,,PreservedSpecimen,230d6a41-24e3-45c5-94de-42def0eeb2b6,DES00015716,,Plantae,Magnoliophyta,,Caryophyllales,Cactaceae,Cylindropuntia acanthocarpa var. coloradensis,19512,(L.D.Benson) D.J.Pinkava,Cylindropuntia,acanthocarpa,var.,coloradensis,,,,,,,,McLeod,,1070,6/25/1973,1973,6,25,176,,,,,,,,,,,,,,0,,,,,USA,Arizona,Yavapai County,,"Rt. 71, 7.9 mi NE of Yavapai Co. Line",,0,,34.079444,-113.021389,,,34d 4m 46s N; 113d 1m 17s W,,,,,,,,,,,,,,,01/06/15 14:31,9287,5,urn:uuid:230d6a41-24e3-45c5-94de-42def0eeb2b6,http://swbiodiversity.org/seinet/collections/individual/index.php?occid=1081022,https://serv.biokic.asu.edu/imglib/h_seinet/seinet/DES/DES00015/DES00015716_lg.jpg
232,1073907,DES,,,PreservedSpecimen,1d3cde6d-78a0-4471-ac94-530b0a42aba2,DES00051156,,Plantae,Magnoliophyta,,Caryophyllales,Cactaceae,Cylindropuntia fulgida var. mamillata,19516,(Schott) Backeb.,Cylindropuntia,fulgida,var.,mamillata,,,,,,,,Wendy C. Hodgson,"Dawn Goldman, Doug Newton",17457,10/08/03,2003,10,8,281,,,,Arizona Upland Sonoran Desert,,,,,,,"Prosopis velutina, Carnegiea gigantea, Cercidium floridum, C. microphyllum, Condalia warnockii, Ambrosia deltoidea, Celtis pallida, Cylindropuntia acanthocarpa thornberi, C. fulgida fulgida, C. fulgida mamillata, Senna covesii.",,,0,,,,,USA,Arizona,Pinal County,,"West of highway 77 on east side of San Pedro River, south of Dudleyville, at Fleiger archaeological site, in vicinity of rock piles, linear alignments, waffle gardens.",,0,,32.8564,-110.714,,,32d 51.384m N; 110d 42.837m W,,,,,,671,,,,,2200ft.,,,,01/06/15 14:31,2151,5,urn:uuid:1d3cde6d-78a0-4471-ac94-530b0a42aba2,http://swbiodiversity.org/seinet/collections/individual/index.php?occid=1073907,https://serv.biokic.asu.edu/imglib/h_seinet/seinet/DES/DES00051/DES00051156_lg.jpg
233,1075376,DES,,,PreservedSpecimen,01d75cd6-ea59-492d-8d55-c5457f529cf2,DES00052136,,Plantae,Magnoliophyta,,Caryophyllales,Cactaceae,Cylindropuntia fulgida var. mamillata,19516,(Schott) Backeb.,Cylindropuntia,fulgida,var.,mamillata,,,,,,,,Wendy C. Hodgson,"Dawn Goldman, Joan LaMoure, Mary Rees",17562,2/24/2004,2004,2,24,55,,,"this is a 3-part specimen, all sheets with same acc.#",Arizona Upland Sonoran Desert,,"Locally common, fruits persistent, hanging.",,,,,"Carnegiea gigantea, Cylindropuntia acanthocarpa, Dodonaea viscosa, Amsinckia, Rhus ovata, Eriogonum wrightii, Amsonia palmeri, Opuntia engelmannii, Gutierrezia, Acacia greggii, Agave chrysantha, Quercus turbinella, Pectocarya, Prosopis velutina.",,,0,,,,,USA,Arizona,Pinal County,,"Tonto National Forest, Superstition Mountains, along Bluff Springs Trail southeast of junction with Terrapin Trail.",,0,,33.41677,-111.349,,,33d 25.006m N; 111d 20.937m W,,,,,,912,,,,,2991ft.,,,,01/06/15 14:31,3603,5,urn:uuid:01d75cd6-ea59-492d-8d55-c5457f529cf2,http://swbiodiversity.org/seinet/collections/individual/index.php?occid=1075376,https://serv.biokic.asu.edu/imglib/h_seinet/seinet/DES/DES00052/DES00052136_lg.jpg
234,1081457,DES,,,PreservedSpecimen,3748b38e-cd51-4c7f-9ce0-d9ceb4aeb14b,DES00003004,,Plantae,Magnoliophyta,,Caryophyllales,Cactaceae,Cylindropuntia fulgida var. mamillata,19516,(Schott) Backeb.,Cylindropuntia,fulgida,var.,mamillata,,,,,,,,Pinkava,"McLeod, McGill, Lehto",17041a,9/18/1970,1970,9,18,261,,,,grassland roadside,,,,,,,"grass, Mesquite",,,0,,,,,USA,Arizona,Pima County,,4.4 mi N of Arivaca Lake.,,0,,31.597,-111.255,,,,,,,,,,,,,,,,,,01/06/15 14:31,9698,5,urn:uuid:3748b38e-cd51-4c7f-9ce0-d9ceb4aeb14b,http://swbiodiversity.org/seinet/collections/individual/index.php?occid=1081457,https://serv.biokic.asu.edu/imglib/h_seinet/seinet/DES/DES00003/DES00003004_lg.jpg
235,2057324,DES,,,PreservedSpecimen,224e041f-5bbb-46b8-8a9d-ca2f2290092e,DES00015703,,Plantae,Magnoliophyta,,Caryophyllales,Cactaceae,Opuntia basilaris var. brachyclada,19548,Munz,Opuntia,basilaris,var.,brachyclada,,,,,,,,McCleod,,1234,10/17/2007,2007,10,17,290,,,No date on sheet. Two sheets. Color photographs,,,,,,,,,flowers & fruit,,0,,,,,USA,California,San Bernardino County,,"Rt 138, 5 miles W of I-15.",,0,,34.355444,-117.529417,,,34d 21m 19.6s N; 117d 31m 45.9s W,,,,,,1066,,,,,3500ft.,,,steve,01/06/15 14:31,22573,5,urn:uuid:224e041f-5bbb-46b8-8a9d-ca2f2290092e,http://swbiodiversity.org/seinet/collections/individual/index.php?occid=2057324,https://serv.biokic.asu.edu/imglib/h_seinet/seinet/DES/DES00015/DES00015703_lg.jpg
