imgname,id,institutionCode,collectionCode,ownerInstitutionCode,basisOfRecord,occurrenceID,catalogNumber,otherCatalogNumbers,kingdom,phylum,class,order,family,scientificName,taxonID,scientificNameAuthorship,genus,specificEpithet,taxonRank,infraspecificEpithet,identifiedBy,dateIdentified,identificationReferences,identificationRemarks,taxonRemarks,identificationQualifier,typeStatus,recordedBy,associatedCollectors,recordNumber,eventDate,year,month,day,startDayOfYear,endDayOfYear,verbatimEventDate,occurrenceRemarks,habitat,substrate,verbatimAttributes,fieldNumber,informationWithheld,dataGeneralizations,dynamicProperties,associatedTaxa,reproductiveCondition,establishmentMeans,cultivationStatus,lifeStage,sex,individualCount,preparations,country,stateProvince,county,municipality,locality,locationRemarks,localitySecurity,localitySecurityReason,decimalLatitude,decimalLongitude,geodeticDatum,coordinateUncertaintyInMeters,verbatimCoordinates,georeferencedBy,georeferenceProtocol,georeferenceSources,georeferenceVerificationStatus,georeferenceRemarks,minimumElevationInMeters,maximumElevationInMeters,minimumDepthInMeters,maximumDepthInMeters,verbatimDepth,verbatimElevation,disposition,language,recordEnteredBy,modified,sourcePrimaryKey-dbpk,collId,recordId,references,accessURI
1,654617,ASU,Plants,,PreservedSpecimen,98a80bd9-fde8-4307-8a06-3f48864f9b7d,ASU0051478,235300,Plantae,Magnoliophyta,,Caryophyllales,Cactaceae,Cylindropuntia leptocaulis,61,(DC.) Knuth,Cylindropuntia,leptocaulis,,,E. Makings,,,,,,,Elizabeth Makings,,3,10/08/00,2000,10,8,282,,,,sandy soil near desert wash,,shrubby cactus ca. 1.5m tall and 2.5m wide with numerous red fruits,,,,shrubby cactus ca. 1.5m tall and 2.5m wide with numerous red fruits,"Cercidium microphyllum, Acacia greggii, Larrea, Ambrosia deltoidea,",fr,,0,,,,,USA,Arizona,Pinal County,,Gold Canyon area,,0,,33.3701,-111.437,,,"N 33d 22.204m, W 111d 26.235m",,,,,,568,,,,,1864ft,,,alorozco,03/08/18 11:13,14848,1,urn:uuid:98a80bd9-fde8-4307-8a06-3f48864f9b7d,http://swbiodiversity.org/seinet/collections/individual/index.php?occid=654617,https://serv.biokic.asu.edu/imglib/h_seinet/seinet/ASU/ASU0051/ASU0051478.jpg
2,693672,ASU,Plants,,PreservedSpecimen,cc7fa5d8-195b-4462-87d5-b5353c81dcae,ASU0051477,246889,Plantae,Magnoliophyta,,Caryophyllales,Cactaceae,Cylindropuntia leptocaulis,61,(DC.) Knuth,Cylindropuntia,leptocaulis,,,,,,,,,,Elizabeth Makings,,659,8/24/2001,2001,8,24,236,,,,"Catclaw acacia woodland, alluvial terrace transitioning into Chihuahuan desertscrub",,"cylindrical-stemmed cactus to 1.5 m, occasional",,,,"cylindrical-stemmed cactus to 1.5 m, occasional","Mimosa aculeaticarpa var. biuncifera, Acacia greggii, Prosopis velutina,  Viguiera dentata, Hymenothrix wislezen",,,0,,,,,USA,Arizona,Cochise County,,"Upper San  Pedro River floodplain,''Contention Mill'' site, ~3 miles north of Hwy 82, ~250m west of San Pedro",,0,,31.7648,-110.204,,,,,,,,,1152,,,,,3781ft,,,Liz,03/08/18 11:13,61764,1,urn:uuid:cc7fa5d8-195b-4462-87d5-b5353c81dcae,http://swbiodiversity.org/seinet/collections/individual/index.php?occid=693672,https://serv.biokic.asu.edu/imglib/h_seinet/seinet/ASU/ASU0051/ASU0051477.jpg
3,724153,ASU,Plants,,PreservedSpecimen,597c16de-5d82-459b-ab24-edb8e23d6030,ASU0051710,246438,Plantae,Magnoliophyta,,Caryophyllales,Cactaceae,Cylindropuntia ramosissima,62,(Engelm.) Knuth,Cylindropuntia,ramosissima,,,,,,,,,,Marc A. Baker,,15389,5/16/2003,2003,5,16,136,,,Photo,Dissected lower bajada,,Frequent shrub,,,,Frequent shrub,"Acamptopappus spaerocephalus, Baileya multiradiata, Cylindropuntia acanthocarpa, C. echinocarpa, Echinocereus engelmannii...",flowers,,0,,,,,USA,Arizona,Mohave County,,Elbow Canyon 7.5' Quad.; 7.8km SSW of Littlefield; 1km southeast of the Virgin River,,0,,36.832,-113.962,,,UTM: 235857 4080131,,,,,,580,,,,,,,,roisan,03/08/18 11:13,96020,1,urn:uuid:597c16de-5d82-459b-ab24-edb8e23d6030,http://swbiodiversity.org/seinet/collections/individual/index.php?occid=724153,https://serv.biokic.asu.edu/imglib/h_seinet/seinet/ASU/ASU0051/ASU0051710.jpg
4,1101015,DES,,,PreservedSpecimen,768ddc03-e0e2-40c2-b5da-be658ec6e26f,DES00055119,,Plantae,Magnoliophyta,,Caryophyllales,Cactaceae,Cylindropuntia x tetracantha,68,(Toumey) Knuth,Cylindropuntia,x tetracantha,,,,,,,,,,R. Puente,A. Puente-Reinhardt,1303,4/15/1999,1999,4,15,105,,,,"Upper Sonoran Desert, granitic substrate on mountainous topography",,"Shrub to 1.5 ft tall, fruits spiny, dry when ripe, Rare",,,,,"Carnegia gigantea, Prosopis juliflora, Cercidium floridum, C. microphyllum, Opuntia leptocaulis, C. acanthocarpa var. major, C. fulgida, C. arbuscula, Opuntia engelmannii var. engelmannii, O. phaeacantha, Larrea tridentata, Lycium spp, Viguiera spp",,,0,,,,,USA,Arizona,Pinal County,,"15 aerial miles due E of Florence, along Whitlow Ranch Rd",,0,,33.001389,-111.288889,,,33d 0m 5s N; 111d 17m 20s W,,,,,,671,,,,,2200ft.,,,Edson,01/06/15 14:31,10894,5,urn:uuid:768ddc03-e0e2-40c2-b5da-be658ec6e26f,http://swbiodiversity.org/seinet/collections/individual/index.php?occid=1101015,https://serv.biokic.asu.edu/imglib/h_seinet/seinet/DES/DES00055/DES00055119_lg.jpg
5,1101016,DES,,,PreservedSpecimen,c1e417c9-c17d-46a7-9f76-90ea781f9ff8,DES00000228,,Plantae,Magnoliophyta,,Caryophyllales,Cactaceae,Cylindropuntia x tetracantha,68,(Toumey) Knuth,Cylindropuntia,x tetracantha,,,,,,,,,,George Olin,,B-527,2/24/1950,1950,2,24,55,,,,,,,,,,,,stems,,0,,,,,USA,Arizona,Pima County,,Tucson.,,0,,32.258214,-110.941928,,,32d 15m 29.57s N; 110d 56m 30.94s W,,,,,,724,,,,,- 2376ft.,,,Steve,01/06/15 14:31,20850,5,urn:uuid:c1e417c9-c17d-46a7-9f76-90ea781f9ff8,http://swbiodiversity.org/seinet/collections/individual/index.php?occid=1101016,https://serv.biokic.asu.edu/imglib/h_seinet/seinet/DES/DES00000/DES00000228_lg.jpg
6,1101017,DES,,,PreservedSpecimen,fc8fa6cd-8e37-49b0-9484-8fef79895e38,DES00063121,,Plantae,Magnoliophyta,,Caryophyllales,Cactaceae,Cylindropuntia x tetracantha,68,(Toumey) Knuth,Cylindropuntia,x tetracantha,,,Donald Pinkava,,,,,,,Marc A. Baker,,8092,2/20/1991,1991,2,20,51,,,,Jojoba scrub.,,"Solitary individual forming a cespitose shrub with 6 main trunks, stems to 6dm long, green with gray wax, the ultimate segments easily detachable but no clong observed; spines purple-brown, sheaths pale gray at base, yellow-brown toward tip; fruit mostly leathery, some dry, generally green suffused with yellow or red, especially toward the apex, upper areoles with spines (these pale gray without sheaths), glochidia dark brown; individuals of the putative parents abundant in the immediate area.",,,,,"Canotia holacantha, Carnegiea gigantea, Cercidium microphyllum, Eriogonum fasciculatum, Gutierrezia sarothrae, Larrea tridentata, Opuntia acanthocarpa (MB8904), O. engelmannii, O, leptocaulis (MB8903), and Prosopis velutina.",,,0,,,,,USA,Arizona,Gila County,,"Tonto Basin, Windy Hill 7.5' USGS topographic map.",,0,,33.741788,-111.08734,,,12S 491910E 3733530N,,,,,,801,,,,,2630ft.,,,lois,7/13/2015 14:23,34814,5,urn:uuid:fc8fa6cd-8e37-49b0-9484-8fef79895e38,http://swbiodiversity.org/seinet/collections/individual/index.php?occid=1101017,https://serv.biokic.asu.edu/imglib/h_seinet/seinet/DES/DES00063/DES00063121_lg.jpg
7,724711,ASU,Plants,,PreservedSpecimen,813a0dfe-d7c9-498a-a335-54845c8f1eae,ASU0051434,147443,Plantae,Magnoliophyta,,Caryophyllales,Cactaceae,Cylindropuntia x kelvinensis,69,(V. Grant & K.A. Grant) P.V. Heath,Cylindropuntia,x kelvinensis,,,"D. J. Pinkava, 1993",,,,,,,Lyle A. McGill,D. J. Pinkava,2462,5/18/1978,1978,5,18,138,,,"Sheet 2 of 2, see 98992; photos; cited Madrono 39(2):101. 1992; Chrom #: n=11",Desert with cacti and mesquite,,"Fruit chains proliferating to 4 units long; perianth pinkish; stigmas cream-white; filaments pink above, green below; style faint pink; plant 1.5-2m tall, 2m wide; anthers yellow; pollen stain = 51.1%",,,,"Fruit chains proliferating to 4 units long; perianth pinkish; stigmas cream-white; filaments pink above, green below; style faint pink; plant 1.5-2m tall, 2m wide; anthers yellow; pollen stain = 51.1%","Cacti, mesquite",flowers & fruit,,0,,,,,USA,Arizona,Pinal County,,Route 289; east of Florence; ca. 15.5 road-miles from junction of Routes 289 and 80-89; then 4.1 road-miles along right fork (ca. 1.4 miles southeast of Box O Ranch turnoff),,0,,32.9331,-111.09,,,,,,GEOLocate_032105; High precision,not reviewed,,,,,,,,,,roisan,03/08/18 11:13,96681,1,urn:uuid:813a0dfe-d7c9-498a-a335-54845c8f1eae,http://swbiodiversity.org/seinet/collections/individual/index.php?occid=724711,https://serv.biokic.asu.edu/imglib/h_seinet/seinet/ASU/ASU0051/ASU0051434.jpg
8,657965,ASU,Plants,,PreservedSpecimen,2595fa86-3c32-4990-aa08-86f2175aba41,,222224,Plantae,Magnoliophyta,,Caryophyllales,Cactaceae,Opuntia microdasys,70,(Lehm.) Pfeiff.,Opuntia,microdasys,,,,,,,,,,Dixie Z. Damrel,D. W. Damrel,2234,5/16/1999,1999,5,16,136,,,Photos,Desert,,"Ca. 60cm tall; growing in spreading, erect clumps ca. 1m x 2m; ca. green pads with white glochids; tepals yellow; filaments yellow; stigma green; this same cactus has been established at least since 1993, when the collectors lived near this area",,,,"Ca. 60cm tall; growing in spreading, erect clumps ca. 1m x 2m; ca. green pads with white glochids; tepals yellow; filaments yellow; stigma green; this same cactus has been established at least since 1993, when the collectors lived near this area",,flowers,,0,,,,,USA,Arizona,Pima County,,"Off of Anklam Road (East of Ankalm Wash) and Shannon Road in West Tucson, in an area of garbage, broken bottles and old ocnstruction refuse",,0,,32.2217,-110.926,,,,,,GEOLocate_032105; Low precision,not reviewed,,,,,,,,,,roisan,03/08/18 11:09,22952,1,urn:uuid:2595fa86-3c32-4990-aa08-86f2175aba41,http://swbiodiversity.org/seinet/collections/individual/index.php?occid=657965,https://serv.biokic.asu.edu/imglib/h_seinet/seinet/Cactaceae/herbarium_sheets/OPMI_222224_M.jpg
9,771122,ASU,Plants,,PreservedSpecimen,b2d717f7-40a9-4995-9b6f-ed7680bf115c,ASU0051364,259080,Plantae,Magnoliophyta,,Caryophyllales,Cactaceae,Cylindropuntia fulgida,85,(Engelm.) Knuth,Cylindropuntia,fulgida,,,,,,,,,,Marc A. Baker,,15705,7/18/2004,2004,7,18,200,,,,Disclimax grassland,,,,,,,"Accacia greggii, Aristida purpurea, A. ternipes, Carnegia gigantea, Celtis pallida?",,,0,,,,,USA,Arizona,Pima County,,"Stevens Mountain; 12 km SSW of of Three Points, 45 km SW of Tucson, Altar Valley, 17 km NW of the summit of the Sierrita Mountains.",,0,,31.972,-111.363,,,,,,,,,885,,,,,2900ft,,,matt,03/08/18 11:13,158748,1,urn:uuid:b2d717f7-40a9-4995-9b6f-ed7680bf115c,http://swbiodiversity.org/seinet/collections/individual/index.php?occid=771122,https://serv.biokic.asu.edu/imglib/h_seinet/seinet/ASU/ASU0051/ASU0051364.jpg
10,891689,ARIZ,,,PreservedSpecimen,urn:uuid:823889c2-c7b9-4c61-a970-f78066b79394,377920,,Plantae,Magnoliophyta,,Caryophyllales,Cactaceae,Cylindropuntia versicolor,86,(Engelm. Ex J. M. Coult.) Knuth,Cylindropuntia,versicolor,,,R. S. Felger,03/09/85,,,,,,"R. S. Felger; Goodman Larson, Jean Russell",,85-546,03/09/85,1985,3,9,68,,"March,9,1985","Cholla 1.5-1.8 m tall; tepals and stamens chartreuse, stamens versitile; old fruit fleshy, persistant, occasionally in 'chains' of 2 or 3 (also on desert flat near entrance)",South-facing rocky slope; near canyon entrance,,,,,,,,,,,,,,,Mexico,Sonora,Guaymas Municipio,,"Cañón Nacapules, ca 6 km north of Bahía San Carlos",,,,28.166667,-111.058333,,,,,,,,,150,,,,,,,,,1/27/2014 10:38,171330,2,urn:uuid:5565a909-d25e-4d71-aa38-eddd7d4dc5f3,http://swbiodiversity.org/seinet/collections/individual/index.php?occid=891689,http://db.herbarium.arizona.edu/images/ARIZ/377/ariz377920_lg.jpg
11,891689,ARIZ,,,PreservedSpecimen,urn:uuid:823889c2-c7b9-4c61-a970-f78066b79394,377920,,Plantae,Magnoliophyta,,Caryophyllales,Cactaceae,Cylindropuntia versicolor,86,(Engelm. Ex J. M. Coult.) Knuth,Cylindropuntia,versicolor,,,R. S. Felger,03/09/85,,,,,,"R. S. Felger; Goodman Larson, Jean Russell",,85-546,03/09/85,1985,3,9,68,,"March,9,1985","Cholla 1.5-1.8 m tall; tepals and stamens chartreuse, stamens versitile; old fruit fleshy, persistant, occasionally in 'chains' of 2 or 3 (also on desert flat near entrance)",South-facing rocky slope; near canyon entrance,,,,,,,,,,,,,,,Mexico,Sonora,Guaymas Municipio,,"Cañón Nacapules, ca 6 km north of Bahía San Carlos",,,,28.166667,-111.058333,,,,,,,,,150,,,,,,,,,1/27/2014 10:38,171330,2,urn:uuid:5565a909-d25e-4d71-aa38-eddd7d4dc5f3,http://swbiodiversity.org/seinet/collections/individual/index.php?occid=891689,http://db.herbarium.arizona.edu/images/ARIZ/377/ariz377920_lg.jpg
12,943912,ARIZ,,,PreservedSpecimen,urn:uuid:2f0cb275-fedd-433b-bfd2-e08afc16b88c,385565,,Plantae,Magnoliophyta,,Caryophyllales,Cactaceae,Cylindropuntia versicolor,86,(Engelm. Ex J. M. Coult.) Knuth,Cylindropuntia,versicolor,,,R. S. Felger,3/13/2007,,,,,,A. L. Reina-G. ; T. R. Van Devender,,2007-251-A,3/13/2007,2007,3,13,72,,"March,13,2007",Solitary cholla in sand dunes.,Sand dunes of strand behind mangroves at water edge.,,,,,,,,,,,,,,,Mexico,Sonora,Guaymas Municipio,,"Estero Soldado, San Carlos.",,,,27.958611,-110.980833,,,,,,,,,,,,,,,,,,1/27/2014 10:38,194017,2,urn:uuid:3142bdaf-1d4b-4d9d-bfbe-2260e73ea91c,http://swbiodiversity.org/seinet/collections/individual/index.php?occid=943912,http://db.herbarium.arizona.edu/images/ARIZ/385/ariz385565_lg.jpg
13,943912,ARIZ,,,PreservedSpecimen,urn:uuid:2f0cb275-fedd-433b-bfd2-e08afc16b88c,385565,,Plantae,Magnoliophyta,,Caryophyllales,Cactaceae,Cylindropuntia versicolor,86,(Engelm. Ex J. M. Coult.) Knuth,Cylindropuntia,versicolor,,,R. S. Felger,3/13/2007,,,,,,A. L. Reina-G. ; T. R. Van Devender,,2007-251-A,3/13/2007,2007,3,13,72,,"March,13,2007",Solitary cholla in sand dunes.,Sand dunes of strand behind mangroves at water edge.,,,,,,,,,,,,,,,Mexico,Sonora,Guaymas Municipio,,"Estero Soldado, San Carlos.",,,,27.958611,-110.980833,,,,,,,,,,,,,,,,,,1/27/2014 10:38,194017,2,urn:uuid:3142bdaf-1d4b-4d9d-bfbe-2260e73ea91c,http://swbiodiversity.org/seinet/collections/individual/index.php?occid=943912,http://db.herbarium.arizona.edu/images/ARIZ/385/ariz385565_lg.jpg
14,943913,ARIZ,,,PreservedSpecimen,urn:uuid:a3420c01-5ff4-4a62-93c4-b618fa4c33ab,388918,,Plantae,Magnoliophyta,,Caryophyllales,Cactaceae,Cylindropuntia versicolor,86,(Engelm. Ex J. M. Coult.) Knuth,Cylindropuntia,versicolor,,,Benjamin T. Wilder,10/26/2007,,,,,,"Benjamin T. Wilder; Brad Boyle, Servando Lopez Monroy, as well as Exequiel Ezcurra, R. S. Felger, Humberto Romero-Morales, et. al.",,07-530,10/26/2007,2007,10,26,299,,"October,26,2007","Dups sent to: ARIZ; Common, ca. 1-1.3 m tall.",Upper E-facing slope above canyon and just below high ridge. Dominated by shrubs ca. 1 m tall where Ambrosia carduacea is dominant and leaf litter coveres the ground. Also,,,,,,,"Agave chrysoglossa, Canotia holacantha, Dasylirion gentryi, Diospyros intricata, Galvezia juncea, Simmondsia chinensis, Ziziphus obtusifolia.",Vegetative,,,,,,,Mexico,Sonora,Hermosillo,,Isla Tiburón. High elevations of the Sierra Kunkaak.,,,,28.965908,-112.329931,,,,,,,,,800,,,,,,,,,09/09/16 13:10,198845,2,urn:uuid:7cd1fa56-73fd-480a-954e-9df76f3eb6cc,http://swbiodiversity.org/seinet/collections/individual/index.php?occid=943913,http://db.herbarium.arizona.edu/images/ARIZ/388/ariz388918_lg.jpg
15,943913,ARIZ,,,PreservedSpecimen,urn:uuid:a3420c01-5ff4-4a62-93c4-b618fa4c33ab,388918,,Plantae,Magnoliophyta,,Caryophyllales,Cactaceae,Cylindropuntia versicolor,86,(Engelm. Ex J. M. Coult.) Knuth,Cylindropuntia,versicolor,,,Benjamin T. Wilder,10/26/2007,,,,,,"Benjamin T. Wilder; Brad Boyle, Servando Lopez Monroy, as well as Exequiel Ezcurra, R. S. Felger, Humberto Romero-Morales, et. al.",,07-530,10/26/2007,2007,10,26,299,,"October,26,2007","Dups sent to: ARIZ; Common, ca. 1-1.3 m tall.",Upper E-facing slope above canyon and just below high ridge. Dominated by shrubs ca. 1 m tall where Ambrosia carduacea is dominant and leaf litter coveres the ground. Also,,,,,,,"Agave chrysoglossa, Canotia holacantha, Dasylirion gentryi, Diospyros intricata, Galvezia juncea, Simmondsia chinensis, Ziziphus obtusifolia.",Vegetative,,,,,,,Mexico,Sonora,Hermosillo,,Isla Tiburón. High elevations of the Sierra Kunkaak.,,,,28.965908,-112.329931,,,,,,,,,800,,,,,,,,,09/09/16 13:10,198845,2,urn:uuid:7cd1fa56-73fd-480a-954e-9df76f3eb6cc,http://swbiodiversity.org/seinet/collections/individual/index.php?occid=943913,http://db.herbarium.arizona.edu/images/ARIZ/388/ariz388918_lg.jpg
16,662784,ASU,Plants,,PreservedSpecimen,ea61db65-03f1-41fc-9618-5c1770ff7221,ASU0089254,243972,Plantae,Magnoliophyta,,Caryophyllales,Cactaceae,Carnegiea gigantea,123,(Engelm.) Britton & Rose,Carnegiea,gigantea,,,,,,,,,,John Anderson,,,5/19/2003,2003,5,19,139,,,Photo only,,,,,,,,,,,0,,,,,USA,Arizona,Mohave County,,"Aquarius Mountains. Cristate saguaro (photo) in bloom on May 19, 2003, 4:30 pm. Photo given to ASU on 11 June 2003.",,0,,35.0833,-113.458,,,,,,GEOLocate_032105; Low precision,not reviewed,,,,,,,,,,,03/08/18 11:13,29666,1,urn:uuid:ea61db65-03f1-41fc-9618-5c1770ff7221,http://swbiodiversity.org/seinet/collections/individual/index.php?occid=662784,https://serv.biokic.asu.edu/imglib/h_seinet/seinet/ASU_Plants/201509/ASU0089254_1442440744_lg.jpg
17,657962,ASU,Plants,,PreservedSpecimen,ac072fd5-12bc-4fe0-9b5d-283daa720d7f,,6999,Plantae,Magnoliophyta,,Caryophyllales,Cactaceae,Stenocereus thurberi,449,(Engelm.) Buxbaum,Stenocereus,thurberi,,,"Pinkava, D.J.",,,,,,,"Blakley, E. R.","Marshall, W.T.",B-222,5/13/1951,1951,5,13,133,,,,"south facing slope, alluvial",,scattered,,,,scattered,,,,0,,,,,USA,Arizona,Pima County,,"2.5 mi S. Ajo, Arizona",,0,,32.3354,-112.86,,,,,,GEOLocate_032105; Medium precision,not reviewed,,437,437,,,,,,,,03/08/18 11:09,22949,1,urn:uuid:ac072fd5-12bc-4fe0-9b5d-283daa720d7f,http://swbiodiversity.org/seinet/collections/individual/index.php?occid=657962,https://serv.biokic.asu.edu/imglib/h_seinet/seinet/Cactaceae/herbarium_sheets/STTH_06999_M.jpg
18,724124,ASU,Plants,,PreservedSpecimen,b760e254-dcfe-4225-bc31-a8582602f158,ASU0051672,190109,Plantae,Magnoliophyta,,Caryophyllales,Cactaceae,Opuntia X neoarbuscula,676,Griffiths (pro sp.),Opuntia,X neoarbuscula,,,"D. J. Pinkava, 1993",,,,,,,Marc A. Baker,"Tom Van Devender, Donald Pinkava, Jon Rebman",10480,3/21/1993,1993,3,21,80,,,Two sheets to collection number; photos,Pale brown silt of flat,,"Shrub 1m tall, 1.5m broad, from single erect trunk; 2° branches 2 in number, suberect; 3° branches ca. whorled, ca. drooping; ultimate branches easily detached; fruit generally tuberculate, oblong, truncate, ca. tapered toward base, single or in chains of two, often with a few caducous spines, yellow-green, often tinged orange, especially above and toward apex; umbilicus to 1cm deep; seeds per fruit: 8, 9, 3, 2, 2, 1, 0, 17, 7, 3, 12, 12, 8, 6, 7, 4, 1, 19, 1, 3, 3, 2, 4, 1, 19, 1, 3, 3, 2, 4, 2, 2, 1, 2, 2, 1, 4, 3, 2",,,,"Shrub 1m tall, 1.5m broad, from single erect trunk; 2° branches 2 in number, suberect; 3° branches ca. whorled, ca. drooping; ultimate branches easily detached; fruit generally tuberculate, oblong, truncate, ca. tapered toward base, single or in chains of two, often with a few caducous spines, yellow-green, often tinged orange, especially above and toward apex; umbilicus to 1cm deep; seeds per fruit: 8, 9, 3, 2, 2, 1, 0, 17, 7, 3, 12, 12, 8, 6, 7, 4, 1, 19, 1, 3, 3, 2, 4, 1, 19, 1, 3, 3, 2, 4, 2, 2, 1, 2, 2, 1, 4, 3, 2","Ambrosia confertiflora, Atriplex canescens, Brickellia coulteri, Carnegiea gigantea, Celtis pallida, Cercidium floridum...",fruit,,0,,,,,USA,Arizona,Pima County,,"0.4 miles northwest of the boundary of the Santa Rita Experimental Range and Wildlife Area, along Santa Rita Road; southeast of Sahuarita",,0,,31.9171,-110.91,,,UTM: 12 508500 3531250; TRS: T17S R14E S28,,,lat/long generated from utm data field data-9Aug05,,,878,,,,,2880ft,,,roisan,03/08/18 11:13,95961,1,urn:uuid:b760e254-dcfe-4225-bc31-a8582602f158,http://swbiodiversity.org/seinet/collections/individual/index.php?occid=724124,https://serv.biokic.asu.edu/imglib/h_seinet/seinet/ASU/ASU0051/ASU0051672.jpg
19,724125,ASU,Plants,,PreservedSpecimen,1f20f757-3fee-4255-9332-05e31233eb7d,ASU0051674,190101,Plantae,Magnoliophyta,,Caryophyllales,Cactaceae,Opuntia X neoarbuscula,676,Griffiths (pro sp.),Opuntia,X neoarbuscula,,,"D. J. Pinkava, 1996",,,,,,,Marc A. Baker,"T. Van Devender, D. Pinkava, J. Rebman",10476-A,3/21/1993,1993,3,21,80,,,"Sheet 1 of 2, see 191159",Mesquite thicket along drainage; pale brown silt of flat,,"Open shrub 2.5m tall, 3m broad, from 2 trunks 4cm diameter; older bark dark gray, fissured; 2° branches twisting-ascending, unbranched below; main upper stems with ca. whorled branching; ultimate stem segments to 2dm long, the shorter very easily detached; fruit generally tuberculate, oblong, truncate, ca. tapered toward base, single or in chains of two, often with a few caducous spines, same color as stem or tinged orange, especially above and toward apex; umbilicus to 1cm deep; seeds per fruit: 5, 0, 0, 0, 1, 0, 0, 1, 0, 0, 0, 0, 0, 8, 1; three individuals in area, smaller individual with habit similar to Opuntia spinosior",,,,"Open shrub 2.5m tall, 3m broad, from 2 trunks 4cm diameter; older bark dark gray, fissured; 2° branches twisting-ascending, unbranched below; main upper stems with ca. whorled branching; ultimate stem segments to 2dm long, the shorter very easily detached; fruit generally tuberculate, oblong, truncate, ca. tapered toward base, single or in chains of two, often with a few caducous spines, same color as stem or tinged orange, especially above and toward apex; umbilicus to 1cm deep; seeds per fruit: 5, 0, 0, 0, 1, 0, 0, 1, 0, 0, 0, 0, 0, 8, 1; three individuals in area, smaller individual with habit similar to Opuntia spinosior","Ambrosia confertiflora, Atriplex canescens, Brickellia coulteri, Carnegiea gigantea, Celtis pallida, Cercidium floridum...",fruit,,0,,,,,USA,Arizona,Pima County,,0.8 miles northwest of the boundary of the Santa Rita Experimental Range and Wildlife Area; along Santa Rita Road; 3.5 air miles southeast of Sahuarita,,0,,31.9171,-110.918,,,UTM: 12 507800 3531250; TRS: T17S R14E S28,,,lat/long generated from utm data field data-9Aug05,,,872,,,,,2860ft,,,roisan,03/08/18 11:13,95964,1,urn:uuid:1f20f757-3fee-4255-9332-05e31233eb7d,http://swbiodiversity.org/seinet/collections/individual/index.php?occid=724125,https://serv.biokic.asu.edu/imglib/h_seinet/seinet/ASU/ASU0051/ASU0051674.jpg
20,724126,ASU,Plants,,PreservedSpecimen,c5912d0a-4bb6-4e44-9a20-858244b76666,ASU0051671,190096,Plantae,Magnoliophyta,,Caryophyllales,Cactaceae,Opuntia X neoarbuscula,676,Griffiths (pro sp.),Opuntia,X neoarbuscula,,,"D. J. Pinkava, 1996",,,,,,,Marc A. Baker,"T. Van Devender, D. Pinkava, J. Rebman",10481,3/21/1993,1993,3,21,80,,,,Pale brown silt of flat,,"Densely-branched shrub 1.9m tall, 4m broad; some fruit in chains of 2; seeds embedded in a gelatinous mass; seeds per fruit: 2, 2, 2, 3, 3, 3, 2, 1, 4, 0, 1, 1, 7, 8, 6, 3, 3, 3, 8, 7, 0, 3, 5, 2, 2, 3",,,,"Densely-branched shrub 1.9m tall, 4m broad; some fruit in chains of 2; seeds embedded in a gelatinous mass; seeds per fruit: 2, 2, 2, 3, 3, 3, 2, 1, 4, 0, 1, 1, 7, 8, 6, 3, 3, 3, 8, 7, 0, 3, 5, 2, 2, 3","Ambrosia confertiflora, Atriplex canescens, Brickellia coulteri, Carnegiea gigantea, Celtis pallida, Cercidium floridum...",flowers & fruit,,0,,,,,USA,Arizona,Pima County,,"Santa Rita Experimental Range and Wildlife Area; 1.5 miles southeast of the boundary, along Santa Rita Road; 10k southeast of Sahuarita",,0,,31.9004,-110.886,,,UTM: 12 510750 3529400; TRS: T17S R14E S35,,,lat/long generated from utm data field data-9Aug05,,,914,,,,,3000ft,,,roisan,03/08/18 11:13,95966,1,urn:uuid:c5912d0a-4bb6-4e44-9a20-858244b76666,http://swbiodiversity.org/seinet/collections/individual/index.php?occid=724126,https://serv.biokic.asu.edu/imglib/h_seinet/seinet/ASU/ASU0051/ASU0051671.jpg
21,1101052,DES,,,PreservedSpecimen,2f44d2df-1886-4025-91b6-ae1d556d23a8,DES00000241,,Plantae,Magnoliophyta,,Caryophyllales,Cactaceae,Sclerocactus intertextus,735,(Engelm.) N.P. Taylor,Sclerocactus,intertextus,,,D.Damrel 11/8/01,,,,,,,E. R. Blakley,W.T. Marshall,,8/20/1950,1950,8,20,232,,,,"bunch grass, south slope, sandy loam",,Common,,,,,,,,0,,,,,USA,Arizona,Cochise County,,2 mi SW Apache Pass,,0,,32.13176,-109.50073,,,,,,,,,1371,,,,,4500ft.,,,jane,12/25/2016 12:09,21679,5,urn:uuid:2f44d2df-1886-4025-91b6-ae1d556d23a8,http://swbiodiversity.org/seinet/collections/individual/index.php?occid=1101052,https://serv.biokic.asu.edu/imglib/h_seinet/seinet/DES/DES00000/DES00000241_lg.jpg
22,2057224,DES,,,PreservedSpecimen,3623ec24-ae34-4913-8ca3-87d9439922d1,DES00039862,,Plantae,Magnoliophyta,,Caryophyllales,Cactaceae,Echinocereus dasyacanthus,2612,Engelm.,Echinocereus,dasyacanthus,,,,,,,,,,R. D. Worthington,,23713,10/01/94,1994,10,1,274,,,,"Rocky canyon, Permian sandstone",,,,,,,,stems,,0,,,,,USA,Texas,Culberson County,,"Delaware Mts., generally 8-9 air miles SE of the jct of Hwys 62-180 with 54.",,0,,31.675,-104.754167,,,31d 40m 30s N; 104d 45m 15s W,,,,,,1402,1524,,,,4600 - 5000ft.,,,Steve,01/06/15 14:31,22434,5,urn:uuid:3623ec24-ae34-4913-8ca3-87d9439922d1,http://swbiodiversity.org/seinet/collections/individual/index.php?occid=2057224,https://serv.biokic.asu.edu/imglib/h_seinet/seinet/DES/DES00039/DES00039862_lg.jpg
